{
  "aviation_support": {
    "blue": {
      "aircraft": 5,
      "combat_aircraft": 2,
      "in_scenario_bases": [],
      "location": "Carrier recovery area east of Hormuz and Al Dhafra Air Base",
      "mode": "off_map",
      "reason": "Campaign air units are represented airborne while their established recovery facilities remain outside the generated tactical order of battle.",
      "tankers": 1
    },
    "red": {
      "aircraft": 0,
      "mode": "not_required"
    }
  },
  "balance": {
    "blue": {
      "effective": 43.573,
      "force": 48.802,
      "objectiveBurden": 1.12
    },
    "model": "role-condition-sustainment-v1",
    "ratio": 1.089,
    "red": {
      "effective": 40.029,
      "force": 40.029,
      "objectiveBurden": 1
    },
    "warnings": []
  },
  "effective_rng_seed": "20260822",
  "generator": {
    "database_schema_version": 4,
    "name": "mission-generator-v2",
    "node": ">=24",
    "version": "0.2.0"
  },
  "inputs": {
    "campaign_state": "c1cff917eb460b1474348c6db3abf014297b2846a482b125c910a2875e743ef2",
    "scenario_seed": "9e7744c5fb5dcefc3ca962f023d55615e6005d88d75f4562bfb82ad5c2d7eb71"
  },
  "logistics": {
    "blue": {
      "allocated": {
        "air_sorties": 11,
        "fuel_points": 47,
        "ordnance_points": 32,
        "repair_capacity_points": 0
      },
      "available": {
        "air_sortie_capacity_next_24h": 28,
        "comment": "A theater reinforcement package can double the original Silver Current force, but the six-ship sealift must enter the Gulf to sustain that posture.",
        "fuel_points": 156,
        "ordnance_points": 148,
        "repair_capacity_points": 92
      }
    },
    "red": {
      "allocated": {
        "air_sorties": 0,
        "fuel_points": 23,
        "ordnance_points": 29,
        "repair_capacity_points": 0
      },
      "available": {
        "coastal_missile_salvo_capacity_next_24h": 2,
        "comment": "Red can reinforce locally over the next several hours with shore systems and short-range naval assets faster than with major blue-water units.",
        "fuel_points": 92,
        "ordnance_points": 86,
        "repair_capacity_points": 61
      }
    }
  },
  "objectives": {
    "blue": {
      "goals": [
        {
          "label": "preserve campaign-critical assets",
          "quantity": 2,
          "targets": [
            "RFA Fort Victoria",
            "USNS Amelia Earhart",
            "USNS John Ericsson"
          ],
          "type": "ProtectGoal"
        },
        {
          "label": "neutralize the designated threat",
          "quantity": 2,
          "targets": [
            "Bastion 1",
            "Bastion 2",
            "Falakhon",
            "Khanjar"
          ],
          "type": "DestroyGoal"
        }
      ],
      "label": "Convoy Escort",
      "mode": 0,
      "type": "CompoundGoal"
    },
    "red": {
      "label": "break the protected force",
      "quantity": 2,
      "targets": [
        "RFA Fort Victoria",
        "USNS Amelia Earhart",
        "USNS John Ericsson"
      ],
      "type": "DestroyGoal"
    }
  },
  "output_hash": "36d434f0484d6a74cac15872a266e38c14193a1a31eff6b03fc4f29367fbdaf5",
  "random_draws": [
    {
      "index": 0,
      "label": "variation:time-offset-minutes",
      "value": 0.285948171513
    },
    {
      "index": 1,
      "label": "variation:sea-state",
      "value": 0.870823491365
    },
    {
      "index": 2,
      "label": "variation:blue:reserve-slots",
      "value": 0.497091995785
    },
    {
      "index": 3,
      "label": "variation:red:reserve-slots",
      "value": 0.397666163743
    },
    {
      "index": 4,
      "label": "roster:blue:RFA Fort Victoria",
      "value": 0.224870167207
    },
    {
      "index": 5,
      "label": "roster:blue:USS Mason",
      "value": 0.516414353391
    },
    {
      "index": 6,
      "label": "roster:blue:USS Tempest",
      "value": 0.648695160402
    },
    {
      "index": 7,
      "label": "roster:blue:HMS Diamond",
      "value": 0.053167624865
    },
    {
      "index": 8,
      "label": "roster:blue:USS Chosin",
      "value": 0.97876950237
    },
    {
      "index": 9,
      "label": "roster:blue:USNS John Ericsson",
      "value": 0.699996511685
    },
    {
      "index": 10,
      "label": "roster:blue:USNS Amelia Earhart",
      "value": 0.416380007053
    },
    {
      "index": 11,
      "label": "roster:blue:USCGC Stone",
      "value": 0.488727314165
    },
    {
      "index": 12,
      "label": "roster:blue:Tiger Flight",
      "value": 0.527731320588
    },
    {
      "index": 13,
      "label": "roster:blue:Lancer Flight",
      "value": 0.222374186153
    },
    {
      "index": 14,
      "label": "roster:blue:Sentinel",
      "value": 0.472556029446
    },
    {
      "index": 15,
      "label": "roster:blue:Shell 1",
      "value": 0.486442316789
    },
    {
      "index": 16,
      "label": "roster:blue:Broadarrow",
      "value": 0.820780667476
    },
    {
      "index": 17,
      "label": "roster:red:Khanjar",
      "value": 0.306698861765
    },
    {
      "index": 18,
      "label": "roster:red:Falakhon",
      "value": 0.446024670033
    },
    {
      "index": 19,
      "label": "roster:red:Bastion 1",
      "value": 0.422272867057
    },
    {
      "index": 20,
      "label": "roster:red:Bastion 2",
      "value": 0.589473390486
    },
    {
      "index": 21,
      "label": "roster:red:Pantsir 1",
      "value": 0.963949109195
    },
    {
      "index": 22,
      "label": "roster:red:Pantsir 2",
      "value": 0.918198850239
    },
    {
      "index": 23,
      "label": "roster:red:S-300 Site North",
      "value": 0.84015480103
    },
    {
      "index": 24,
      "label": "roster:red:Coastwatch 1",
      "value": 0.55728184944
    },
    {
      "index": 25,
      "label": "roster:red:Coastwatch 2",
      "value": 0.308397438144
    },
    {
      "index": 26,
      "label": "roster:red:Bandar Abbas Strip",
      "value": 0.736928806873
    },
    {
      "index": 27,
      "label": "blue:Broadarrow:air:lat",
      "value": 0.184507936006
    },
    {
      "index": 28,
      "label": "blue:Broadarrow:air:lon",
      "value": 0.077628527535
    },
    {
      "index": 29,
      "label": "blue:Lancer Flight:air:lat",
      "value": 0.793498482322
    },
    {
      "index": 30,
      "label": "blue:Lancer Flight:air:lon",
      "value": 0.454813346034
    },
    {
      "index": 31,
      "label": "blue:Sentinel:air:lat",
      "value": 0.868091959273
    },
    {
      "index": 32,
      "label": "blue:Sentinel:air:lon",
      "value": 0.973493166966
    },
    {
      "index": 33,
      "label": "blue:Shell 1:air:lat",
      "value": 0.905108140083
    },
    {
      "index": 34,
      "label": "blue:Shell 1:air:lon",
      "value": 0.033899026224
    },
    {
      "index": 35,
      "label": "blue:Tiger Flight:air:lat",
      "value": 0.013884256827
    },
    {
      "index": 36,
      "label": "blue:Tiger Flight:air:lon",
      "value": 0.78373381705
    },
    {
      "index": 37,
      "label": "red:Bandar Abbas Strip:visibility",
      "value": 0.502050908981
    },
    {
      "index": 38,
      "label": "red:Bastion 1:visibility",
      "value": 0.593360135099
    },
    {
      "index": 39,
      "label": "red:Bastion 2:visibility",
      "value": 0.428153506247
    },
    {
      "index": 40,
      "label": "red:Coastwatch 1:visibility",
      "value": 0.008889879333
    },
    {
      "index": 41,
      "label": "red:Coastwatch 2:visibility",
      "value": 0.032158801798
    },
    {
      "index": 42,
      "label": "red:Falakhon:visibility",
      "value": 0.490135517437
    },
    {
      "index": 43,
      "label": "red:Khanjar:visibility",
      "value": 0.059998512268
    },
    {
      "index": 44,
      "label": "red:Pantsir 1:visibility",
      "value": 0.040402163053
    },
    {
      "index": 45,
      "label": "red:Pantsir 2:visibility",
      "value": 0.755734871142
    },
    {
      "index": 46,
      "label": "red:S-300 Site North:visibility",
      "value": 0.68619587156
    }
  ],
  "rejected_units": [
    {
      "reasons": [
        "status is destroyed",
        "mission_capable is false",
        "structural integrity is below 30%"
      ],
      "side": "red",
      "unit_name": "Peykan"
    },
    {
      "reasons": [
        "mission_capable is false"
      ],
      "side": "red",
      "unit_name": "Joshan"
    },
    {
      "reasons": [
        "status is destroyed",
        "mission_capable is false",
        "structural integrity is below 30%"
      ],
      "side": "red",
      "unit_name": "Shamshir"
    },
    {
      "reasons": [
        "status is destroyed",
        "mission_capable is false",
        "structural integrity is below 30%"
      ],
      "side": "red",
      "unit_name": "Phantom Flight"
    }
  ],
  "scenario": {
    "archetype": "convoy_escort",
    "id": "resolute_passage_generated_001",
    "name": "Operation Resolute Passage — Campaign Generated",
    "theater_id": "hormuz_mvp"
  },
  "schema_version": 1,
  "selected_units": [
    {
      "applied": {
        "always_visible": false,
        "fuel_fraction": 0.64,
        "launchers": [],
        "loadout_setup": null,
        "magazines": [],
        "position": {
          "altitude": 8000,
          "lat": 25.247606,
          "lon": 57.377629
        },
        "route": [
          {
            "altitude": 7600,
            "lat": 26.1,
            "lon": 57.5,
            "speed": 280
          },
          {
            "altitude": 7600,
            "lat": 25.95,
            "lon": 56.95,
            "speed": 280
          }
        ],
        "sorties": 1,
        "speed_kts": 420,
        "tasks": [
          "Aircraft1",
          "Nav"
        ]
      },
      "domain": "air",
      "platform_class": "P-8 MPA",
      "role": "maritime_patrol",
      "side": "blue",
      "source_state": {